{
  "schema_version": "1.0", "protocol": "koni.parity-case.v1", "id": "KPAR-SWF-0001", "revision": 1,
  "title": "Software bug-fix workflow", "domain": "software", "tier": "P0",
  "summary": "A bug-fix run compiles diagnosis, reproducer, bounded implementation, regression proof, review, and explicit delivery.",
  "drivers": ["rust-oracle", "typescript-target"], "fixture": "fixture:software-bug", "action_script": "reference/parity/actions/KPAR-SWF-0001.json",
  "checkpoints": [{"id": "C01-delivered", "after_action": "S07-capture", "capture": ["graph", "tickets", "plans", "receipts", "git", "reports"], "assertions": ["A01-diagnosis-first", "A02-regression-proof", "A03-delivery-explicit"]}],
  "assertions": [
    {"id": "A01-diagnosis-first", "checkpoint": "C01-delivered", "surface": "graph", "comparator": "semantic", "authority": "oracle", "disposition": "none", "description": "The implementation ticket depends on a concrete symptom, causal diagnosis, and expected-red reproducer.", "expected": {"diagnosis_before_implementation": true}},
    {"id": "A02-regression-proof", "checkpoint": "C01-delivered", "surface": "receipts", "comparator": "invariant", "authority": "oracle", "disposition": "none", "description": "Closure binds a passing regression check plus configured broader checks and a current reviewer verdict.", "expected": {"regression_passed": true, "review_current": true}},
    {"id": "A03-delivery-explicit", "checkpoint": "C01-delivered", "surface": "git", "comparator": "git_topology", "authority": "oracle", "disposition": "none", "description": "The run becomes merge-ready and reaches the target only after explicit operator merge.", "expected": {"explicit_target_merge": true}}
  ]
}
