{
  "schema_version": "1.0", "protocol": "koni.parity-case.v1", "id": "KPAR-CFG-0002", "revision": 1,
  "title": "Research profile install and pin", "domain": "config", "tier": "P0",
  "summary": "A fresh research install materializes validated epistemic graph, ticket, operation, and persona resources.",
  "drivers": ["rust-oracle", "typescript-target"], "fixture": "fixture:empty-git-project", "action_script": "reference/parity/actions/KPAR-CFG-0002.json",
  "checkpoints": [{"id": "C01-installed", "after_action": "S03-capture", "capture": ["profile", "config", "graph"], "assertions": ["A01-profile-valid", "A02-reciprocal-edges"]}],
  "assertions": [
    {"id": "A01-profile-valid", "checkpoint": "C01-installed", "surface": "profile", "comparator": "structural", "authority": "oracle", "disposition": "none", "description": "Installed research profile validates with all compiler-owned resources pinned.", "expected": {"valid": true, "profile": "research"}},
    {"id": "A02-reciprocal-edges", "checkpoint": "C01-installed", "surface": "config", "comparator": "semantic", "authority": "oracle", "disposition": "none", "description": "Reciprocal scientific relationships are represented as one bidirectional edge rather than redundant circular declarations.", "expected": {"redundant_reciprocal_rules": 0}}
  ]
}
