{
  "schema_version": "1.0", "protocol": "koni.parity-case.v1", "id": "KPAR-RUN-0001", "revision": 2,
  "title": "Run target branch and isolated worktree", "domain": "run", "tier": "P0",
  "summary": "Run creation binds a selected target branch and uses an isolated detached planning checkout without creating a permanent run ref before approval.",
  "drivers": ["rust-oracle", "typescript-target"], "fixture": "fixture:multi-branch-software-project", "action_script": "reference/parity/actions/KPAR-RUN-0001.json",
  "checkpoints": [{"id": "C01-created", "after_action": "S04-capture", "capture": ["run_state", "git", "worktrees", "filesystem"], "assertions": ["A01-target-bound", "A02-worktree-isolated"]}],
  "assertions": [
    {"id": "A01-target-bound", "checkpoint": "C01-created", "surface": "run_state", "comparator": "structural", "authority": "oracle", "disposition": "none", "description": "The immutable run record binds the selected target ref and its start commit.", "expected": {"target_ref": "feature/recent", "target_start_commit_bound": true}},
    {"id": "A02-worktree-isolated", "checkpoint": "C01-created", "surface": "git", "comparator": "git_topology", "authority": "specification", "disposition": "superseded", "issue_ref": "KBUG-GIT-0001", "description": "Planning owns a distinct detached checkout while the target remains unchanged; the first permanent run ref and worktree are created only by exact plan approval.", "expected": {"target_checkout_dirty": false, "planning_checkout_detached": true, "permanent_run_ref_before_approval": false}}
  ]
}
