{
  "schema_version": "1.0", "protocol": "koni.parity-case.v1", "id": "KPAR-TUI-0002", "revision": 1,
  "title": "Questions panel and answer editor", "domain": "tui", "tier": "P0",
  "summary": "Pending questions occupy the lower Details column and expose the same complete answer/notes interaction in panel and modal form.",
  "drivers": ["rust-oracle", "typescript-target"], "fixture": "fixture:pending-question-batch", "action_script": "reference/parity/actions/KPAR-TUI-0002.json",
  "checkpoints": [{"id": "C01-pending", "after_action": "S02-capture-pending", "capture": ["tui", "questions"], "assertions": ["A01-panel-complete", "A02-modal-equivalent"]}, {"id": "C02-answered", "after_action": "S06-capture-answered", "capture": ["tui", "questions", "run_state"], "assertions": ["A03-answer-durable"]}],
  "assertions": [
    {"id": "A01-panel-complete", "checkpoint": "C01-pending", "surface": "tui", "comparator": "tui_semantics", "authority": "oracle", "disposition": "none", "description": "Long question and option descriptions wrap; arrow keys navigate options and questions without truncation.", "expected": {"question_truncated": false, "option_description_wrapped": true}},
    {"id": "A02-modal-equivalent", "checkpoint": "C01-pending", "surface": "tui", "comparator": "tui_semantics", "authority": "oracle", "disposition": "none", "description": "Inline panel and expanded editor both permit a provided option or none-of-the-above plus optional multiline notes.", "expected": {"none_of_above": true, "notes_with_any_answer": true}},
    {"id": "A03-answer-durable", "checkpoint": "C02-answered", "surface": "questions", "comparator": "structural", "authority": "oracle", "disposition": "none", "description": "Submission atomically records all selected choices and notes, then hides the pending panel.", "expected": {"pending": 0, "answer_batch_complete": true}}
  ]
}
