{
  "schema_version": "1.0", "protocol": "koni.parity-case.v1", "id": "KPAR-GIT-0001", "revision": 1,
  "title": "Merge-ready requires explicit target merge", "domain": "git", "tier": "P0",
  "summary": "Completion marks a run merge-ready but never mutates its target branch until the operator explicitly requests merge.",
  "drivers": ["rust-oracle", "typescript-target"], "fixture": "fixture:completed-run", "action_script": "reference/parity/actions/KPAR-GIT-0001.json",
  "checkpoints": [
    {"id": "C01-ready", "after_action": "S02-capture-ready", "capture": ["run_state", "git", "worktrees"], "assertions": ["A01-no-auto-merge"]},
    {"id": "C02-merged", "after_action": "S04-capture-merged", "capture": ["run_state", "git", "worktrees", "receipts"], "assertions": ["A02-explicit-merge"]}
  ],
  "assertions": [
    {"id": "A01-no-auto-merge", "checkpoint": "C01-ready", "surface": "git", "comparator": "git_topology", "authority": "oracle", "disposition": "none", "description": "The target ref remains at its start commit while the run advertises merge-ready.", "expected": {"target_changed": false, "merge_ready": true}},
    {"id": "A02-explicit-merge", "checkpoint": "C02-merged", "surface": "receipts", "comparator": "invariant", "authority": "oracle", "disposition": "none", "description": "Explicit merge validates target drift, integrates once, records a receipt, and retires the run worktree safely.", "expected": {"merge_receipts": 1, "target_contains_run": true}}
  ]
}
