{
  "schema_version": "1.0", "protocol": "koni.parity-case.v1", "id": "KPAR-PLN-0002", "revision": 1,
  "title": "Plan revision creates a successor attempt", "domain": "planning", "tier": "P0",
  "summary": "Steering a candidate plan preserves history and creates a fresh immutable planning attempt rather than mutating a terminal session.",
  "drivers": ["rust-oracle", "typescript-target"], "fixture": "fixture:planned-software-run", "action_script": "reference/parity/actions/KPAR-PLN-0002.json",
  "checkpoints": [{"id": "C01-revised", "after_action": "S05-capture", "capture": ["plans", "run_state", "sessions", "events"], "assertions": ["A01-history-preserved", "A02-successor-session"]}],
  "assertions": [
    {"id": "A01-history-preserved", "checkpoint": "C01-revised", "surface": "plans", "comparator": "invariant", "authority": "oracle", "disposition": "none", "description": "The prior candidate and steering text remain immutable audit history and the new candidate links to both.", "expected": {"prior_candidate_preserved": true, "steering_preserved": true}},
    {"id": "A02-successor-session", "checkpoint": "C01-revised", "surface": "sessions", "comparator": "structural", "authority": "specification", "disposition": "superseded", "issue_ref": "KBUG-SES-0001", "description": "Revision runs in a fresh linear native Pi session/attempt with a new grant and explicit predecessor reference.", "expected": {"fresh_session": true, "fresh_grant": true, "predecessor_bound": true}}
  ]
}
