{
  "schema_version": "1.0", "protocol": "koni.parity-case.v1", "id": "KPAR-SES-0001", "revision": 1,
  "title": "Native Pi transcript, usage, compaction, and restart", "domain": "session", "tier": "P0",
  "summary": "Pi JSONL is the complete conversation record while Koni binds attempt identity, authority context, usage, and terminal outcome.",
  "drivers": ["typescript-target"], "fixture": "fixture:contained-pi-session", "action_script": "reference/parity/actions/KPAR-SES-0001.json",
  "checkpoints": [{"id": "C01-restored", "after_action": "S06-capture", "capture": ["sessions", "usage", "run_state", "grants"], "assertions": ["A01-full-transcript", "A02-usage-complete", "A03-authority-reissued", "A04-linear-attempt"]}],
  "assertions": [
    {"id": "A01-full-transcript", "checkpoint": "C01-restored", "surface": "sessions", "comparator": "structural", "authority": "specification", "disposition": "superseded", "issue_ref": "KBUG-SES-0001", "description": "Native Pi JSONL preserves complete user and assistant messages, reasoning visibility policy, tool calls/results, custom entries, compaction, and steering.", "expected": {"lossy_transport_reconstruction": false}},
    {"id": "A02-usage-complete", "checkpoint": "C01-restored", "surface": "usage", "comparator": "invariant", "authority": "specification", "disposition": "superseded", "issue_ref": "KBUG-SES-0001", "description": "Usage separately retains input, cached input, output, reasoning, new-token, and total-token accounting without double count.", "expected": {"cached_input_in_total": true, "double_count": false}},
    {"id": "A03-authority-reissued", "checkpoint": "C01-restored", "surface": "grants", "comparator": "security", "authority": "specification", "disposition": "oracle_gap", "description": "After compaction or restart, authoritative context and hashes are reissued by Koni; a summary never replaces them.", "expected": {"summary_is_authority": false, "context_hash_revalidated": true}},
    {"id": "A04-linear-attempt", "checkpoint": "C01-restored", "surface": "sessions", "comparator": "invariant", "authority": "specification", "disposition": "oracle_gap", "description": "One immutable attempt owns one fresh linear Pi session; rework or revision creates a successor attempt instead of an authority-bearing session branch.", "expected": {"authority_branches": 0}}
  ]
}
