{
  "schema_version": "1.0", "protocol": "koni.parity-case.v1", "id": "KPAR-SCH-0001", "revision": 1,
  "title": "DAG readiness and maximum parallelism", "domain": "scheduler", "tier": "P0",
  "summary": "The authority derives only dependency-ready assignments and never exceeds the compiled parallelism limit.",
  "drivers": ["rust-oracle", "typescript-target"], "fixture": "fixture:branched-ticket-dag", "action_script": "reference/parity/actions/KPAR-SCH-0001.json",
  "checkpoints": [{"id": "C01-dispatched", "after_action": "S03-capture", "capture": ["tickets", "agents", "grants", "events"], "assertions": ["A01-ready-only", "A02-parallel-bound"]}],
  "assertions": [
    {"id": "A01-ready-only", "checkpoint": "C01-dispatched", "surface": "tickets", "comparator": "invariant", "authority": "oracle", "disposition": "none", "description": "Every dispatched ticket has all declared predecessors closed at the dispatch revision.", "expected": {"unready_dispatches": 0}},
    {"id": "A02-parallel-bound", "checkpoint": "C01-dispatched", "surface": "agents", "comparator": "invariant", "authority": "oracle", "disposition": "none", "description": "Live immutable attempts never exceed max_parallel and distinct ready tickets may run concurrently.", "expected": {"max_parallel": 2, "peak_live_attempts": 2}}
  ]
}
