{
  "schema_version": "1.0", "protocol": "koni.parity-case.v1", "id": "KPAR-TUI-0003", "revision": 1,
  "title": "Plan review and adaptive revision action", "domain": "tui", "tier": "P0",
  "summary": "Review displays authored human mini-plans and one primary action that changes from approval to revision when steering is present.",
  "drivers": ["rust-oracle", "typescript-target"], "fixture": "fixture:plan-awaiting-approval", "action_script": "reference/parity/actions/KPAR-TUI-0003.json",
  "checkpoints": [{"id": "C01-review", "after_action": "S02-capture-review", "capture": ["tui", "plans"], "assertions": ["A01-authored-mini-plans", "A02-one-adaptive-action"]}, {"id": "C02-revision", "after_action": "S05-capture-revision", "capture": ["tui", "plans", "sessions"], "assertions": ["A03-multiline-revision"]}],
  "assertions": [
    {"id": "A01-authored-mini-plans", "checkpoint": "C01-review", "surface": "plans", "comparator": "semantic", "authority": "specification", "disposition": "oracle_gap", "description": "Architecture, Decisions, Risk, and Verification each contain planner-authored structured header/description items, not headings synthesized from prose fragments.", "expected": {"authored_structured_summaries": true}},
    {"id": "A02-one-adaptive-action", "checkpoint": "C01-review", "surface": "tui", "comparator": "tui_semantics", "authority": "specification", "disposition": "oracle_gap", "description": "Exactly one Start-run-styled primary button says Approve run while steering is empty and Revise plan when steering is nonempty.", "expected": {"primary_buttons": 1, "adaptive_label": true}},
    {"id": "A03-multiline-revision", "checkpoint": "C02-revision", "surface": "tui", "comparator": "tui_semantics", "authority": "oracle", "disposition": "none", "description": "The steering editor wraps multiple lines and submitting revision closes review into visible planning activity without approving execution.", "expected": {"multiline": true, "approved": false}}
  ]
}
