{
  "schema_version": "1.0", "protocol": "koni.parity-case.v1", "id": "KPAR-BRK-0001", "revision": 1,
  "title": "Grant, CAS, replay, and terminal enforcement", "domain": "broker", "tier": "P0",
  "summary": "Every effect is admitted by the authority against an immutable grant, exact expected state, replay nonce, and live attempt boundary.",
  "drivers": ["rust-oracle", "typescript-target"], "fixture": "fixture:authorized-worker-attempt", "action_script": "reference/parity/actions/KPAR-BRK-0001.json",
  "checkpoints": [{"id": "C01-enforced", "after_action": "S06-capture", "capture": ["grants", "receipts", "run_state", "filesystem"], "assertions": ["A01-valid-once", "A02-invalid-no-effect", "A03-terminal-closed"]}],
  "assertions": [
    {"id": "A01-valid-once", "checkpoint": "C01-enforced", "surface": "receipts", "comparator": "security", "authority": "oracle", "disposition": "none", "description": "One valid broker call under the exact grant and expected-state hash produces one receipt.", "expected": {"valid_receipts": 1}},
    {"id": "A02-invalid-no-effect", "checkpoint": "C01-enforced", "surface": "filesystem", "comparator": "security", "authority": "oracle", "disposition": "none", "description": "Replay, stale-state, out-of-scope, and mismatched-attempt calls fail closed before any durable or filesystem effect.", "expected": {"invalid_effects": 0}},
    {"id": "A03-terminal-closed", "checkpoint": "C01-enforced", "surface": "run_state", "comparator": "security", "authority": "oracle", "disposition": "none", "description": "A terminal attempt can no longer exercise its grant even if the credential and nonce are replayed.", "expected": {"post_terminal_effects": 0}}
  ]
}
