{
  "schema_version": "1.0", "protocol": "koni.parity-case.v1", "id": "KPAR-CFG-0003", "revision": 1,
  "title": "Project overlay survives profile upgrade", "domain": "config", "tier": "P0",
  "summary": "A bundled baseline upgrade changes only managed baseline content and preserves project-owned overrides and run state.",
  "drivers": ["rust-oracle", "typescript-target"], "fixture": "fixture:configured-software-project", "action_script": "reference/parity/actions/KPAR-CFG-0003.json",
  "checkpoints": [{"id": "C01-upgraded", "after_action": "S04-capture", "capture": ["profile", "config", "filesystem", "run_state"], "assertions": ["A01-overlay-preserved", "A02-state-preserved"]}],
  "assertions": [
    {"id": "A01-overlay-preserved", "checkpoint": "C01-upgraded", "surface": "config", "comparator": "exact_bytes", "authority": "specification", "disposition": "oracle_defect", "issue_ref": "KBUG-CFG-0001", "description": "Project-owned overlay files are byte-identical after a bundled baseline upgrade.", "expected": {"project_overlay_changed": false}},
    {"id": "A02-state-preserved", "checkpoint": "C01-upgraded", "surface": "run_state", "comparator": "security", "authority": "specification", "disposition": "oracle_gap", "description": "Upgrade never rewrites, migrates, or deletes run state without a separate guarded migration.", "expected": {"run_state_changed": false}}
  ]
}
